{
  "problem_statement": "将代理规范重构为 Harness Engineering 形态，同时保留审计能力。",
  "success_criteria": [
    "角色减少",
    "引入结构化 harness 工件",
    "设计先行"
  ],
  "scope": {
    "in_scope": ["AGENTS.md", ".codex/harness", ".codex/agents", ".codex/config.toml"],
    "out_of_scope": ["业务功能代码"]
  },
  "research_summary": "官方与成熟实践都支持薄角色卡、厚环境工件与 eval-driven 迭代。",
  "reuse_decision_matrix": {
    "candidate_existing_interfaces": ["workflow_state", "docs_impact", "gate_result"],
    "fitness_score_existing": 78,
    "fitness_score_new_design": 92,
    "decision": "NEW_INTERFACE",
    "decision_rationale": "需要引入 harness 层与新的阶段状态机以降低提示词重复。",
    "migration_strategy": "保留控制平面角色名称，迁出旧静态专家。",
    "compatibility_strategy": "不保留旧兼容层，但保留核心 artifact 名称。"
  },
  "options_considered": [
    {
      "name": "强控制平面 + harness 工件",
      "mechanism": "保留核心角色，新增 policies/schemas/templates/evals。",
      "tradeoffs": ["前期需要补建工件与脚本"]
    },
    {
      "name": "激进单代理化",
      "mechanism": "只保留一个编排者，其他能力全用技能和检索补足。",
      "tradeoffs": ["审计面会变薄", "迁移风险更高"],
      "rejected_reason": "当前仓库已有较强门禁需求，不宜一次性去掉控制平面。"
    }
  ],
  "selected_design": {
    "architecture_summary": "以 pipeline/planner/explorer/reviewer/tester 为控制平面，harness 作为运行时事实源。",
    "interface_changes": ["新增 research_brief", "新增 design_packet", "新增 session acceptance runner"],
    "data_flow": "用户目标 -> intake_brief -> research_brief -> design_packet -> critique_report -> delivery_report",
    "failure_modes": ["研究证据不足", "设计未获批准", "评测失败"],
    "migration_plan": "先切宪法层与角色层，再补 eval runner 和 bundle 流程。"
  },
  "verification_plan": [
    "schema 校验",
    "旧字段残留扫描",
    "样例 bundle 跑通"
  ],
  "rollback_plan": [
    "回退到旧规范文件",
    "恢复旧 agent 注册"
  ],
  "user_approval_points": [
    "是否接受新增 session bundle 结构",
    "是否接受不保留旧静态专家"
  ],
  "approval_status": "draft"
}
